Id;Código;Persona;Sección;Fecha De Creación;Autor;Fecha última Edición;último Editor;Fecha ;Estudiante con diagnostico?;Falta segun Manual de Convivencia;Descripcion de la falta;Acciones Reparadoras;Acta de Descargos
8898;3314;Ramírez Hurtado Diego Alejandro;Décimo Segundo A;27/08/2025 10:28;Castro Escobar (Homeroom Teacher 8A   Artes Visuales 7-12) Angely Xiomara;27/08/2025 10:28;Castro Escobar (Homeroom Teacher 8A   Artes Visuales 7-12) Angely Xiomara;26/08/2025;No;3.Incumplimiento con el reglamento interno sobre el manejo de elementos electrónicos dentro del colegio (capítulo 3 de este Manual);El estudiante estaba usando el celular de su compañero Kaito en la clase. Es importante resaltar que previamente se les había indicado que los celulares deben estar dentro de las maletas ya que el uso de este está prohibido en la institución.;socializar con el grupo sobre la importancia de acatar las normas de clase y las consecuencias del el no cumplimiento de ellas.;
3112;1591;Emura Hernandez Kaito Mateo;Décimo Segundo A;27/08/2025 10:26;Castro Escobar (Homeroom Teacher 8A   Artes Visuales 7-12) Angely Xiomara;27/08/2025 10:26;Castro Escobar (Homeroom Teacher 8A   Artes Visuales 7-12) Angely Xiomara;26/08/2025;No;3.Incumplimiento con el reglamento interno sobre el manejo de elementos electrónicos dentro del colegio (capítulo 3 de este Manual);Un compañero de Kaito estaba usando su celular en la clase lo cual está prohibido el uso de este. Previamente se les había dicho las reglas de clase donde el celular debe permanecer  dentro de la maleta.;socializar con el grupo sobre la importancia de acatar las normas de clase y las consecuencias del el no cumplimiento de ellas.;
3715;1896;Bernal Arias Ana Maria;Décimo Segundo B;26/08/2025 14:10;Grajales Becerra (DL   Homeroom Teacher 10B   Economía y C. Políticas 12) Paula Andrea;26/08/2025 14:10;Grajales Becerra (DL   Homeroom Teacher 10B   Economía y C. Políticas 12) Paula Andrea;25/08/2025;No;3.Incumplimiento con el reglamento interno sobre el manejo de elementos electrónicos dentro del colegio (capítulo 3 de este Manual);Durante las horas del almuerzo la estudiante es vista en la cancha de futbol manipulando su teléfono celular. Se le solicita entregarlo frente a la política de manejo de dispositivos electrónicos. Y se le entrega dicho dispositivo a la coordinadora de high school para seguir con el procedimiento que se aplica en estos casos.;La estudiante debe preparar una presentación para su homeroom en donde explique a sus compañeros de qué manera podemos hacer un uso adecuado de los tiempos libres y el por qué es importante para la salud mental no hacer un uso excesivo de los dispositivos móviles.;
4153;2059;Feria Ruiz Diego Arturo;Décimo B;20/08/2025 9:17;Peláez Peláez (Homeroom Teacher 12B   Español y Literatura 10B-12) Juan Camilo;20/08/2025 9:17;Peláez Peláez (Homeroom Teacher 12B   Español y Literatura 10B-12) Juan Camilo;20/08/2025;;9.Impuntualidad en la llegada tarde al colegio a las actividades académicas y formativas;El estudiante llega tarde a clase dos minutos sin excusa válida. Se le invita a estar más atento de los horarios de finalización de los descansos para que no se retrase.;Supervisar descanso con el docente.;
3219;1721;Marulanda Franco Jacobo;Décimo B;20/08/2025 9:16;Peláez Peláez (Homeroom Teacher 12B   Español y Literatura 10B-12) Juan Camilo;20/08/2025 9:16;Peláez Peláez (Homeroom Teacher 12B   Español y Literatura 10B-12) Juan Camilo;20/08/2025;;9.Impuntualidad en la llegada tarde al colegio a las actividades académicas y formativas;El estudiante llega tarde a clase dos minutos sin excusa válida. Se le invita a estar más atento de los horarios de finalización de los descansos para que no se retrase.;Supervisar descanso con el docente.;
3238;1726;Escobar Cañas Sebasthian;Décimo B;20/08/2025 9:15;Peláez Peláez (Homeroom Teacher 12B   Español y Literatura 10B-12) Juan Camilo;20/08/2025 9:15;Peláez Peláez (Homeroom Teacher 12B   Español y Literatura 10B-12) Juan Camilo;20/08/2025;;9.Impuntualidad en la llegada tarde al colegio a las actividades académicas y formativas;El estudiante llega tarde a clase dos minutos sin excusa válida. Se le invita a estar más atento de los horarios de finalización de los descansos para que no se retrase.;Supervisar descanso con el docente.;
3926;1984;Galindo Sarria Alejandro;Undécimo B;15/08/2025 10:15;Peláez Peláez (Homeroom Teacher 12B   Español y Literatura 10B-12) Juan Camilo;15/08/2025 10:15;Peláez Peláez (Homeroom Teacher 12B   Español y Literatura 10B-12) Juan Camilo;15/08/2025;;7.Faltas de consideración con el otro como gritar utilizar vocabulario soez hablar de manera despectiva menospreciar a cualquier miembro de la comunidad o dinámicas que impliquen lastimar a otros incluyendo las consensuadas.;El estudiante realiza un comentario con carga semántica ofensiva hacia su compañero Samuel Amaya pues le puso una tapa de lapicero negra sobre su piel y en toco burlesco dice: &quot.Amaya la tapa no se le ve en la piel&quot.. El estudiante señala que son dinámicas consensuadas sin embargo es importante resaltar que estamos en un contexto educativo.;Pedir perdón al compañero frente al salón pues la burla fue frente a todos.;
